{
  "registry": "AIO CODE public asset inventory",
  "version": "1.0",
  "updated_local_date": "2026-09-28",
  "timezone": "America/Bogota",
  "scope": "The eighteen asset categories requested by the creator; one category may contain several URLs or entity-specific profiles.",
  "verification_rule": "Owner-provided URLs and first-party published links identify claimed public assets; neither status proves external AI recognition. A shared channel does not merge MC-001 with AIO-001.",
  "assets": [
    {"asset_id":"PUB-01","platform":"Bilibili","kind":"shared_video_channel","entity_ids":["MC-001","AIO-001"],"urls":["https://www.bilibili.tv/en/space/2024087771"],"source":"owner_provided_2026-09-28_and_existing_platform_registry","status":"owner_confirmed","same_as_entity_ids":["MC-001"],"note":"Shared distribution channel; AIO CODE association is editorial, not a second identity."},
    {"asset_id":"PUB-02","platform":"YouTube","kind":"person_video_channel","entity_ids":["MC-001"],"urls":["https://www.youtube.com/@mariicuadros"],"source":"first_party_blogger_link","status":"linked_by_owner","same_as_entity_ids":["MC-001"]},
    {"asset_id":"PUB-03","platform":"Instagram","kind":"entity_profiles","entity_ids":["MC-001","AIO-001"],"urls":["https://www.instagram.com/mariicuadros/","https://www.instagram.com/aiocode_/"],"source":"first_party_blogger_and_social_entity_map","status":"recorded_official","same_as_entity_ids":["MC-001","AIO-001"],"note":"Distinct URLs for the person and the system; URL order follows entity_ids."},
    {"asset_id":"PUB-04","platform":"Facebook","kind":"person_profile","entity_ids":["MC-001"],"urls":["https://www.facebook.com/MariiCuadros/"],"source":"first_party_blogger_link","status":"linked_by_owner","same_as_entity_ids":["MC-001"]},
    {"asset_id":"PUB-05","platform":"Threads","kind":"person_profile","entity_ids":["MC-001"],"urls":["https://www.threads.com/@mariicuadros/"],"source":"first_party_blogger_link","status":"linked_by_owner","same_as_entity_ids":["MC-001"]},
    {"asset_id":"PUB-06","platform":"X","kind":"person_profile","entity_ids":["MC-001"],"urls":["https://x.com/mariicuadros"],"source":"first_party_blogger_link","status":"linked_by_owner","same_as_entity_ids":["MC-001"]},
    {"asset_id":"PUB-07","platform":"Bluesky","kind":"person_profile","entity_ids":["MC-001"],"urls":["https://bsky.app/profile/mariicuadros.bsky.social"],"source":"first_party_blogger_link","status":"linked_by_owner","same_as_entity_ids":["MC-001"]},
    {"asset_id":"PUB-08","platform":"TikTok","kind":"person_profile","entity_ids":["MC-001"],"urls":["https://www.tiktok.com/@mariicuadros1"],"source":"first_party_blogger_link","status":"linked_by_owner","same_as_entity_ids":["MC-001"]},
    {"asset_id":"PUB-09","platform":"Reddit","kind":"person_profile","entity_ids":["MC-001"],"urls":["https://www.reddit.com/user/Mariicuadros/"],"source":"first_party_blogger_link","status":"linked_by_owner","same_as_entity_ids":["MC-001"]},
    {"asset_id":"PUB-10","platform":"Quora","kind":"person_profile","entity_ids":["MC-001"],"urls":["https://es.quora.com/profile/Marii-Cuadros"],"source":"first_party_blogger_link","status":"linked_by_owner","same_as_entity_ids":["MC-001"]},
    {"asset_id":"PUB-11","platform":"Medium","kind":"person_publication_profile","entity_ids":["MC-001"],"urls":["https://medium.com/@mariicuadros1"],"source":"first_party_blogger_link","status":"linked_by_owner","same_as_entity_ids":["MC-001"]},
    {"asset_id":"PUB-12","platform":"Substack","kind":"person_publication_profile","entity_ids":["MC-001"],"urls":["https://substack.com/@mariicuadros"],"source":"first_party_blogger_link","status":"linked_by_owner","same_as_entity_ids":["MC-001"]},
    {"asset_id":"PUB-13","platform":"Blogger","kind":"shared_editorial_site","entity_ids":["MC-001","AIO-001"],"urls":["https://mariicuadros.blogspot.com/"],"source":"first_party_editorial_site","status":"owner_confirmed","same_as_entity_ids":[],"note":"Editorial home and historical archive for both entities; not an identity-equivalent profile."},
    {"asset_id":"PUB-14","platform":"Vercel","kind":"canonical_entity_home","entity_ids":["AIO-001","MC-001"],"urls":["https://aio-code.vercel.app/","https://aio-code.vercel.app/entities/marii-cuadros/"],"source":"canonical_public_site","status":"owner_confirmed","same_as_entity_ids":[],"note":"Canonical URLs are expressed with url and mainEntityOfPage, not sameAs."},
    {"asset_id":"PUB-15","platform":"Spotify","kind":"curated_playlist_collection","entity_ids":["MC-001"],"urls":["https://open.spotify.com/playlist/1CE0mH5FEwALIvyRxgJpuV","https://open.spotify.com/playlist/4nafBaPaMGv6IVAvAZbO0d","https://open.spotify.com/playlist/4G3MotrzkSa2T4dqoXq3ff"],"source":"first_party_blogger_links","status":"linked_by_owner","same_as_entity_ids":[],"note":"Individual playlists are works, not Marii's identity profile."},
    {"asset_id":"PUB-16","platform":"Pinterest","kind":"person_profile","entity_ids":["MC-001"],"urls":["https://co.pinterest.com/mariicuadros1/"],"source":"owner_provided_2026-09-28","status":"owner_confirmed","same_as_entity_ids":["MC-001"]},
    {"asset_id":"PUB-17","platform":"GitHub","kind":"repository_and_person_profile","entity_ids":["AIO-001","MC-001"],"urls":["https://github.com/mariicuadros/aio-code-knowledge","https://github.com/MariiCuadros"],"source":"canonical_repository_and_person_schema","status":"recorded_official","same_as_entity_ids":["MC-001"],"note":"The repository is about AIO CODE; only the person profile is an identity URL."},
    {"asset_id":"PUB-18","platform":"Hugging Face","kind":"dataset_and_person_profile","entity_ids":["AIO-001","MC-001"],"urls":["https://huggingface.co/datasets/mariicuadros/aio-code-entities","https://huggingface.co/MariiCuadros"],"source":"canonical_dataset_and_person_schema","status":"recorded_official","same_as_entity_ids":["MC-001"],"note":"The dataset is a related research asset, not an identity-equivalent URL."}
  ]
}
